1,101,2025-11-02,Smartphone Samsung A54,Teléfonos,1,389.99,389.99,Tarjeta
2,102,2025-11-03,Laptop Lenovo IdeaPad 5,Laptops,1,729.00,729.00,Transferencia
3,103,2025-11-05,Audífonos Sony WH-CH720N,Audio,2,79.50,159.00,Efectivo
4,104,2025-11-07,Tablet Samsung Galaxy Tab A8,Tablets,1,245.00,245.00,Tarjeta
5,105,2025-11-09,Smartwatch Xiaomi Mi Band 8,Wearables,3,42.00,126.00,Efectivo
6,101,2025-11-10,Teclado Mecánico Redragon K552,Accesorios,1,45.99,45.99,Transferencia
7,106,2025-11-12,Mouse Logitech M720 Triathlon,Accesorios,1,38.50,38.50,Efectivo
